Level,Education
Primary or No Education,Early childhood education (ISCED 0) / no education
Primary or No Education,Primary education (ISCED 1)
Lower Secondary,Lower secondary education (ISCED 2)
Upper to Post Secondary,Upper secondary education (ISCED 3)
Upper to Post Secondary,Post-secondary non-tertiary education (ISCED 4)
Upper to Post Secondary,Short-cycle tertiary education (ISCED 5)
Tertiary,Bachelor or equivalent (ISCED 6)
Tertiary,Masters or equivalent (ISCED 7)
Tertiary,Doctoral or equivalent (ISCED 8)
